Enter password: ******************
Welcome to the MySQL monitor.  Commands end with ; or \g.
Your MySQL connection id is 19
Server version: 8.0.46 MySQL Community Server - GPL

Copyright (c) 2000, 2026, Oracle and/or its affiliates.

Oracle is a registered trademark of Oracle Corporation and/or its
affiliates. Other names may be trademarks of their respective
owners.

Type 'help;' or '\h' for help. Type '\c' to clear the current input statement.

mysql> USE DA6;
Database changed
mysql> SHOW TABLES;
+---------------+
| Tables_in_da6 |
+---------------+
| products      |
| students      |
+---------------+
2 rows in set (0.05 sec)

mysql> DROP TABLE PRODUCTS;
Query OK, 0 rows affected (0.07 sec)

mysql> CREATE TABLE Products (
    ->  id INT,
    ->  name VARCHAR(100),
    ->  price DECIMAL(10,2),
    ->  qty INT
    ->  );
Query OK, 0 rows affected (0.09 sec)

mysql>
mysql>
mysql> INSERT INTO Products VALUES
    ->  (1, 'Pen', 10.00, 100),
    ->  (2, 'Notebook', 25.00, 50),
    ->  (3, 'Pencil', 5.00, 200),
    ->  (4, 'Eraser', 3.00, 300),
    ->  (5, 'Marker', 15.00, 80),
    ->  (6, 'Scale', 20.00, 150),
    ->  (7, 'Sharpener', 8.00, 120),
    ->  (8, 'Geometry Box', 120.00, 40),
    ->  (9, 'Sketch Pen', 60.00, 75),
    ->  (10, 'Crayons', 90.00, 55);
Query OK, 10 rows affected (0.01 sec)
Records: 10  Duplicates: 0  Warnings: 0

mysql> SELECT* FROM PRODUCTS;
+------+--------------+--------+------+
| id   | name         | price  | qty  |
+------+--------------+--------+------+
|    1 | Pen          |  10.00 |  100 |
|    2 | Notebook     |  25.00 |   50 |
|    3 | Pencil       |   5.00 |  200 |
|    4 | Eraser       |   3.00 |  300 |
|    5 | Marker       |  15.00 |   80 |
|    6 | Scale        |  20.00 |  150 |
|    7 | Sharpener    |   8.00 |  120 |
|    8 | Geometry Box | 120.00 |   40 |
|    9 | Sketch Pen   |  60.00 |   75 |
|   10 | Crayons      |  90.00 |   55 |
+------+--------------+--------+------+
10 rows in set (0.01 sec)

mysql> SELECT NAME,PRICE+(PRICE*0.12) AS PRICE_WITH_TAX FROM PRODUCTS;
+--------------+----------------+
| NAME         | PRICE_WITH_TAX |
+--------------+----------------+
| Pen          |        11.2000 |
| Notebook     |        28.0000 |
| Pencil       |         5.6000 |
| Eraser       |         3.3600 |
| Marker       |        16.8000 |
| Scale        |        22.4000 |
| Sharpener    |         8.9600 |
| Geometry Box |       134.4000 |
| Sketch Pen   |        67.2000 |
| Crayons      |       100.8000 |
+--------------+----------------+
10 rows in set (0.04 sec)

mysql> SELECT NAME,PRICE-5 AS PRICE FROM PRODUCTS;
+--------------+--------+
| NAME         | PRICE  |
+--------------+--------+
| Pen          |   5.00 |
| Notebook     |  20.00 |
| Pencil       |   0.00 |
| Eraser       |  -2.00 |
| Marker       |  10.00 |
| Scale        |  15.00 |
| Sharpener    |   3.00 |
| Geometry Box | 115.00 |
| Sketch Pen   |  55.00 |
| Crayons      |  85.00 |
+--------------+--------+
10 rows in set (0.04 sec)

mysql> SELECT NAME,PRICE,PRICE-5 AS DISCOUNTED PRICE FROM PRODUCTS;
ERROR 1064 (42000): You have an error in your SQL syntax; check the manual that corresponds to your MySQL server version for the right syntax to use near 'PRICE FROM PRODUCTS' at line 1
mysql> SELECT NAME,PRICE,PRICE-5 S DISCOUNTED PRICE FROM PRODUCTS.
    -> ^C
mysql> SELECT NAME,PRICE,PRICE-5 DISCOUNTED PRICE FROM PRODUCTS;
ERROR 1064 (42000): You have an error in your SQL syntax; check the manual that corresponds to your MySQL server version for the right syntax to use near 'PRICE FROM PRODUCTS' at line 1
mysql> SELECT*FROM PRODUCTS;
+------+--------------+--------+------+
| id   | name         | price  | qty  |
+------+--------------+--------+------+
|    1 | Pen          |  10.00 |  100 |
|    2 | Notebook     |  25.00 |   50 |
|    3 | Pencil       |   5.00 |  200 |
|    4 | Eraser       |   3.00 |  300 |
|    5 | Marker       |  15.00 |   80 |
|    6 | Scale        |  20.00 |  150 |
|    7 | Sharpener    |   8.00 |  120 |
|    8 | Geometry Box | 120.00 |   40 |
|    9 | Sketch Pen   |  60.00 |   75 |
|   10 | Crayons      |  90.00 |   55 |
+------+--------------+--------+------+
10 rows in set (0.00 sec)

mysql> SELECT NAME,PRICE,PRICE-5 AS DISCOUNTED_PRICE FROM PRODUCTS;
+--------------+--------+------------------+
| NAME         | PRICE  | DISCOUNTED_PRICE |
+--------------+--------+------------------+
| Pen          |  10.00 |             5.00 |
| Notebook     |  25.00 |            20.00 |
| Pencil       |   5.00 |             0.00 |
| Eraser       |   3.00 |            -2.00 |
| Marker       |  15.00 |            10.00 |
| Scale        |  20.00 |            15.00 |
| Sharpener    |   8.00 |             3.00 |
| Geometry Box | 120.00 |           115.00 |
| Sketch Pen   |  60.00 |            55.00 |
| Crayons      |  90.00 |            85.00 |
+--------------+--------+------------------+
10 rows in set (0.00 sec)

mysql> SELECT NAME,PRICE,QUANTITY,PRICE*QUANTITY AS INVENTORY PRICE FROM STUDENTS;
ERROR 1064 (42000): You have an error in your SQL syntax; check the manual that corresponds to your MySQL server version for the right syntax to use near 'PRICE FROM STUDENTS' at line 1
mysql>
mysql> SELECT NAME,PRICE,QUANTITY,PRICE*QUANTITY AS INVENTORY_PRICE FROM PRODUCTS;
ERROR 1054 (42S22): Unknown column 'QUANTITY' in 'field list'
mysql> SELECT NAME,PRICE,QTY,PRICE*QTY AS INVENTORY_PRICE FROM PRODUCTS;
+--------------+--------+------+-----------------+
| NAME         | PRICE  | QTY  | INVENTORY_PRICE |
+--------------+--------+------+-----------------+
| Pen          |  10.00 |  100 |         1000.00 |
| Notebook     |  25.00 |   50 |         1250.00 |
| Pencil       |   5.00 |  200 |         1000.00 |
| Eraser       |   3.00 |  300 |          900.00 |
| Marker       |  15.00 |   80 |         1200.00 |
| Scale        |  20.00 |  150 |         3000.00 |
| Sharpener    |   8.00 |  120 |          960.00 |
| Geometry Box | 120.00 |   40 |         4800.00 |
| Sketch Pen   |  60.00 |   75 |         4500.00 |
| Crayons      |  90.00 |   55 |         4950.00 |
+--------------+--------+------+-----------------+
10 rows in set (0.00 sec)

mysql> SELECT NAME,PRICE,PRICE*10 AS INVENTORY_PRICE FROM PRODUCTS;
+--------------+--------+-----------------+
| NAME         | PRICE  | INVENTORY_PRICE |
+--------------+--------+-----------------+
| Pen          |  10.00 |          100.00 |
| Notebook     |  25.00 |          250.00 |
| Pencil       |   5.00 |           50.00 |
| Eraser       |   3.00 |           30.00 |
| Marker       |  15.00 |          150.00 |
| Scale        |  20.00 |          200.00 |
| Sharpener    |   8.00 |           80.00 |
| Geometry Box | 120.00 |         1200.00 |
| Sketch Pen   |  60.00 |          600.00 |
| Crayons      |  90.00 |          900.00 |
+--------------+--------+-----------------+
10 rows in set (0.00 sec)

mysql> SELECT NAME,PRICE,PRICE*10 AS PRICE_PER_10_UNITS FROM PRODUCTS;
+--------------+--------+--------------------+
| NAME         | PRICE  | PRICE_PER_10_UNITS |
+--------------+--------+--------------------+
| Pen          |  10.00 |             100.00 |
| Notebook     |  25.00 |             250.00 |
| Pencil       |   5.00 |              50.00 |
| Eraser       |   3.00 |              30.00 |
| Marker       |  15.00 |             150.00 |
| Scale        |  20.00 |             200.00 |
| Sharpener    |   8.00 |              80.00 |
| Geometry Box | 120.00 |            1200.00 |
| Sketch Pen   |  60.00 |             600.00 |
| Crayons      |  90.00 |             900.00 |
+--------------+--------+--------------------+
10 rows in set (0.00 sec)

mysql> SELECT*FROM PRODUCTS WHERE QTY%50!=0;
+------+--------------+--------+------+
| id   | name         | price  | qty  |
+------+--------------+--------+------+
|    5 | Marker       |  15.00 |   80 |
|    7 | Sharpener    |   8.00 |  120 |
|    8 | Geometry Box | 120.00 |   40 |
|    9 | Sketch Pen   |  60.00 |   75 |
|   10 | Crayons      |  90.00 |   55 |
+------+--------------+--------+------+
5 rows in set (0.00 sec)

mysql> SELECT*FROM PRODUCTS WHERE QTY%50<>0;
+------+--------------+--------+------+
| id   | name         | price  | qty  |
+------+--------------+--------+------+
|    5 | Marker       |  15.00 |   80 |
|    7 | Sharpener    |   8.00 |  120 |
|    8 | Geometry Box | 120.00 |   40 |
|    9 | Sketch Pen   |  60.00 |   75 |
|   10 | Crayons      |  90.00 |   55 |
+------+--------------+--------+------+
5 rows in set (0.00 sec)

mysql> SELECT NAME,PRICE,QTY+2 AS NEW_QUANTITY FROM PRODUCTS;
+--------------+--------+--------------+
| NAME         | PRICE  | NEW_QUANTITY |
+--------------+--------+--------------+
| Pen          |  10.00 |          102 |
| Notebook     |  25.00 |           52 |
| Pencil       |   5.00 |          202 |
| Eraser       |   3.00 |          302 |
| Marker       |  15.00 |           82 |
| Scale        |  20.00 |          152 |
| Sharpener    |   8.00 |          122 |
| Geometry Box | 120.00 |           42 |
| Sketch Pen   |  60.00 |           77 |
| Crayons      |  90.00 |           57 |
+--------------+--------+--------------+
10 rows in set (0.00 sec)

mysql> SELECT NAME,PRICE,PRICE-5 AS NEW_PRICE FROM PRODUCTS;
+--------------+--------+-----------+
| NAME         | PRICE  | NEW_PRICE |
+--------------+--------+-----------+
| Pen          |  10.00 |      5.00 |
| Notebook     |  25.00 |     20.00 |
| Pencil       |   5.00 |      0.00 |
| Eraser       |   3.00 |     -2.00 |
| Marker       |  15.00 |     10.00 |
| Scale        |  20.00 |     15.00 |
| Sharpener    |   8.00 |      3.00 |
| Geometry Box | 120.00 |    115.00 |
| Sketch Pen   |  60.00 |     55.00 |
| Crayons      |  90.00 |     85.00 |
+--------------+--------+-----------+
10 rows in set (0.00 sec)

mysql> UPDATE PRODUCTS SET QTY=QTY+2;
Query OK, 10 rows affected (0.00 sec)
Rows matched: 10  Changed: 10  Warnings: 0

mysql> SELECT* FROM PRODUCTS
    -> SELECT* FROM PRODUCTS;
ERROR 1064 (42000): You have an error in your SQL syntax; check the manual that corresponds to your MySQL server version for the right syntax to use near 'SELECT* FROM PRODUCTS' at line 2
mysql> SELECT*FROM PRODUCTS;
+------+--------------+--------+------+
| id   | name         | price  | qty  |
+------+--------------+--------+------+
|    1 | Pen          |  10.00 |  102 |
|    2 | Notebook     |  25.00 |   52 |
|    3 | Pencil       |   5.00 |  202 |
|    4 | Eraser       |   3.00 |  302 |
|    5 | Marker       |  15.00 |   82 |
|    6 | Scale        |  20.00 |  152 |
|    7 | Sharpener    |   8.00 |  122 |
|    8 | Geometry Box | 120.00 |   42 |
|    9 | Sketch Pen   |  60.00 |   77 |
|   10 | Crayons      |  90.00 |   57 |
+------+--------------+--------+------+
10 rows in set (0.00 sec)

mysql> UPDATE PRODUCTS SET PRICE=PRICE-5;
Query OK, 10 rows affected (0.04 sec)
Rows matched: 10  Changed: 10  Warnings: 0

mysql> SELECT*FROM PRODUCTS;
+------+--------------+--------+------+
| id   | name         | price  | qty  |
+------+--------------+--------+------+
|    1 | Pen          |   5.00 |  102 |
|    2 | Notebook     |  20.00 |   52 |
|    3 | Pencil       |   0.00 |  202 |
|    4 | Eraser       |  -2.00 |  302 |
|    5 | Marker       |  10.00 |   82 |
|    6 | Scale        |  15.00 |  152 |
|    7 | Sharpener    |   3.00 |  122 |
|    8 | Geometry Box | 115.00 |   42 |
|    9 | Sketch Pen   |  55.00 |   77 |
|   10 | Crayons      |  85.00 |   57 |
+------+--------------+--------+------+
10 rows in set (0.00 sec)

mysql> UPDATE PRODUCTS SET QTY=QTY*2 WHERE NAME='ERASER';
Query OK, 1 row affected (0.00 sec)
Rows matched: 1  Changed: 1  Warnings: 0

mysql> SELECT*FROM PRODUCTS;
+------+--------------+--------+------+
| id   | name         | price  | qty  |
+------+--------------+--------+------+
|    1 | Pen          |   5.00 |  102 |
|    2 | Notebook     |  20.00 |   52 |
|    3 | Pencil       |   0.00 |  202 |
|    4 | Eraser       |  -2.00 |  604 |
|    5 | Marker       |  10.00 |   82 |
|    6 | Scale        |  15.00 |  152 |
|    7 | Sharpener    |   3.00 |  122 |
|    8 | Geometry Box | 115.00 |   42 |
|    9 | Sketch Pen   |  55.00 |   77 |
|   10 | Crayons      |  85.00 |   57 |
+------+--------------+--------+------+
10 rows in set (0.00 sec)

mysql> UPDATE PRODUCTS SET QTY=QTY/2 WHERE NAME='MARKERS';
Query OK, 0 rows affected (0.00 sec)
Rows matched: 0  Changed: 0  Warnings: 0

mysql> SELECT*FROM PRODUCTS;
+------+--------------+--------+------+
| id   | name         | price  | qty  |
+------+--------------+--------+------+
|    1 | Pen          |   5.00 |  102 |
|    2 | Notebook     |  20.00 |   52 |
|    3 | Pencil       |   0.00 |  202 |
|    4 | Eraser       |  -2.00 |  604 |
|    5 | Marker       |  10.00 |   82 |
|    6 | Scale        |  15.00 |  152 |
|    7 | Sharpener    |   3.00 |  122 |
|    8 | Geometry Box | 115.00 |   42 |
|    9 | Sketch Pen   |  55.00 |   77 |
|   10 | Crayons      |  85.00 |   57 |
+------+--------------+--------+------+
10 rows in set (0.00 sec)

mysql> DELETE FROM PRODUCTS WHERE QTY<100;
Query OK, 5 rows affected (0.01 sec)

mysql> SELECT*FROM PRODUCTS;
+------+-----------+-------+------+
| id   | name      | price | qty  |
+------+-----------+-------+------+
|    1 | Pen       |  5.00 |  102 |
|    3 | Pencil    |  0.00 |  202 |
|    4 | Eraser    | -2.00 |  604 |
|    6 | Scale     | 15.00 |  152 |
|    7 | Sharpener |  3.00 |  122 |
+------+-----------+-------+------+
5 rows in set (0.00 sec)

mysql> DELETE FROM PRODUCTS WHERE QTY>100;
Query OK, 5 rows affected (0.04 sec)

mysql> SELECT*FROM PRODUCTS;
Empty set (0.00 sec)

mysql> CREATE TABLE StudentScores (
    ->  id INT,
    ->  name VARCHAR(100),
    ->  subject VARCHAR(50),
    ->  marks INT
    ->  );
Query OK, 0 rows affected (0.02 sec)

mysql>
mysql> -- STEP 2: Insert Records
mysql> INSERT INTO StudentScores VALUES
    ->  (1, 'Alice', 'Math', 95),
    ->  (2, 'Bob', 'Math', 76),
    ->  (3, 'Charlie', 'Math', 59),
    ->  (4, 'Diana', 'Math', 88),
    ->  (5, 'Eve', 'Math', 40),
    ->  (6, 'Frank', 'Math', 95),
    ->  (7, 'Grace', 'Science', 67),
    ->  (8, 'Henry', 'Science', 82),
    ->  (9, 'Ivy', 'English', 91),
    ->  (10, 'Jack', 'English', 55),
    ->  (11, 'Kevin', 'Math', 73),
    ->  (12, 'Lily', 'Science', 48),
    ->  (13, 'Mia', 'English', 100),
    ->  (14, 'Noah', 'Math', 64),
    ->  (15, 'Olivia', 'Science', 79);
Query OK, 15 rows affected (0.01 sec)
Records: 15  Duplicates: 0  Warnings: 0

mysql> SELECT*FROM PRODUCTS;
Empty set (0.00 sec)

mysql> SELECT*FROM STUDENTSCORES;
+------+---------+---------+-------+
| id   | name    | subject | marks |
+------+---------+---------+-------+
|    1 | Alice   | Math    |    95 |
|    2 | Bob     | Math    |    76 |
|    3 | Charlie | Math    |    59 |
|    4 | Diana   | Math    |    88 |
|    5 | Eve     | Math    |    40 |
|    6 | Frank   | Math    |    95 |
|    7 | Grace   | Science |    67 |
|    8 | Henry   | Science |    82 |
|    9 | Ivy     | English |    91 |
|   10 | Jack    | English |    55 |
|   11 | Kevin   | Math    |    73 |
|   12 | Lily    | Science |    48 |
|   13 | Mia     | English |   100 |
|   14 | Noah    | Math    |    64 |
|   15 | Olivia  | Science |    79 |
+------+---------+---------+-------+
15 rows in set (0.00 sec)

mysql> SELECT* FROM STUDENTSCORES WHERE MARKS>80;
+------+-------+---------+-------+
| id   | name  | subject | marks |
+------+-------+---------+-------+
|    1 | Alice | Math    |    95 |
|    4 | Diana | Math    |    88 |
|    6 | Frank | Math    |    95 |
|    8 | Henry | Science |    82 |
|    9 | Ivy   | English |    91 |
|   13 | Mia   | English |   100 |
+------+-------+---------+-------+
6 rows in set (0.00 sec)

mysql> SELECT*FROM STUDENTSCORES WHERE MARKS>=60;
+------+--------+---------+-------+
| id   | name   | subject | marks |
+------+--------+---------+-------+
|    1 | Alice  | Math    |    95 |
|    2 | Bob    | Math    |    76 |
|    4 | Diana  | Math    |    88 |
|    6 | Frank  | Math    |    95 |
|    7 | Grace  | Science |    67 |
|    8 | Henry  | Science |    82 |
|    9 | Ivy    | English |    91 |
|   11 | Kevin  | Math    |    73 |
|   13 | Mia    | English |   100 |
|   14 | Noah   | Math    |    64 |
|   15 | Olivia | Science |    79 |
+------+--------+---------+-------+
11 rows in set (0.00 sec)

mysql> SELECT*FROM STUDENTSCORES WHERE MARKS<50;
+------+------+---------+-------+
| id   | name | subject | marks |
+------+------+---------+-------+
|    5 | Eve  | Math    |    40 |
|   12 | Lily | Science |    48 |
+------+------+---------+-------+
2 rows in set (0.00 sec)

mysql> SELECT*FROM STUDENTSCORES WHERE MARKS=95;
+------+-------+---------+-------+
| id   | name  | subject | marks |
+------+-------+---------+-------+
|    1 | Alice | Math    |    95 |
|    6 | Frank | Math    |    95 |
+------+-------+---------+-------+
2 rows in set (0.00 sec)

mysql> SELECT*FROM STUDENTSCORES WHERE MARKS!=95;
+------+---------+---------+-------+
| id   | name    | subject | marks |
+------+---------+---------+-------+
|    2 | Bob     | Math    |    76 |
|    3 | Charlie | Math    |    59 |
|    4 | Diana   | Math    |    88 |
|    5 | Eve     | Math    |    40 |
|    7 | Grace   | Science |    67 |
|    8 | Henry   | Science |    82 |
|    9 | Ivy     | English |    91 |
|   10 | Jack    | English |    55 |
|   11 | Kevin   | Math    |    73 |
|   12 | Lily    | Science |    48 |
|   13 | Mia     | English |   100 |
|   14 | Noah    | Math    |    64 |
|   15 | Olivia  | Science |    79 |
+------+---------+---------+-------+
13 rows in set (0.00 sec)

mysql> SELECT*FROM STUDENTSCORES WHERE MARKS<=60;
+------+---------+---------+-------+
| id   | name    | subject | marks |
+------+---------+---------+-------+
|    3 | Charlie | Math    |    59 |
|    5 | Eve     | Math    |    40 |
|   10 | Jack    | English |    55 |
|   12 | Lily    | Science |    48 |
+------+---------+---------+-------+
4 rows in set (0.00 sec)

mysql> UPDATE STUDENTSCORES SET MARKS+10 WHERE MARKS>50;
ERROR 1064 (42000): You have an error in your SQL syntax; check the manual that corresponds to your MySQL server version for the right syntax to use near '+10 WHERE MARKS>50' at line 1
mysql> UPDATE STUDENTSCORES SET MARKS=MARKS+10 WHERE MARKS>50;
Query OK, 13 rows affected (0.00 sec)
Rows matched: 13  Changed: 13  Warnings: 0

mysql> SELECT*FROM STUDENTSCORES;
+------+---------+---------+-------+
| id   | name    | subject | marks |
+------+---------+---------+-------+
|    1 | Alice   | Math    |   105 |
|    2 | Bob     | Math    |    86 |
|    3 | Charlie | Math    |    69 |
|    4 | Diana   | Math    |    98 |
|    5 | Eve     | Math    |    40 |
|    6 | Frank   | Math    |   105 |
|    7 | Grace   | Science |    77 |
|    8 | Henry   | Science |    92 |
|    9 | Ivy     | English |   101 |
|   10 | Jack    | English |    65 |
|   11 | Kevin   | Math    |    83 |
|   12 | Lily    | Science |    48 |
|   13 | Mia     | English |   110 |
|   14 | Noah    | Math    |    74 |
|   15 | Olivia  | Science |    89 |
+------+---------+---------+-------+
15 rows in set (0.00 sec)

mysql> UPDATE STUDENTSCORES WHERE MARKS=MARKS+5 WHERE MARKS<=60;
ERROR 1064 (42000): You have an error in your SQL syntax; check the manual that corresponds to your MySQL server version for the right syntax to use near 'WHERE MARKS=MARKS+5 WHERE MARKS<=60' at line 1
mysql> UPDATE STUDENTSCORES SET MARKS=MARKS+5 WHERE MARKS<=60;
Query OK, 2 rows affected (0.00 sec)
Rows matched: 2  Changed: 2  Warnings: 0

mysql> SELECT*FROM STUDENTSCORES;
+------+---------+---------+-------+
| id   | name    | subject | marks |
+------+---------+---------+-------+
|    1 | Alice   | Math    |   105 |
|    2 | Bob     | Math    |    86 |
|    3 | Charlie | Math    |    69 |
|    4 | Diana   | Math    |    98 |
|    5 | Eve     | Math    |    45 |
|    6 | Frank   | Math    |   105 |
|    7 | Grace   | Science |    77 |
|    8 | Henry   | Science |    92 |
|    9 | Ivy     | English |   101 |
|   10 | Jack    | English |    65 |
|   11 | Kevin   | Math    |    83 |
|   12 | Lily    | Science |    53 |
|   13 | Mia     | English |   110 |
|   14 | Noah    | Math    |    74 |
|   15 | Olivia  | Science |    89 |
+------+---------+---------+-------+
15 rows in set (0.00 sec)

mysql> UPDATE STUDENTSCORES SET MARKS=MARKS+2 WHERE MARKS>90;
Query OK, 6 rows affected (0.00 sec)
Rows matched: 6  Changed: 6  Warnings: 0

mysql> SELECT*FROM STUDENTSCORES;
+------+---------+---------+-------+
| id   | name    | subject | marks |
+------+---------+---------+-------+
|    1 | Alice   | Math    |   107 |
|    2 | Bob     | Math    |    86 |
|    3 | Charlie | Math    |    69 |
|    4 | Diana   | Math    |   100 |
|    5 | Eve     | Math    |    45 |
|    6 | Frank   | Math    |   107 |
|    7 | Grace   | Science |    77 |
|    8 | Henry   | Science |    94 |
|    9 | Ivy     | English |   103 |
|   10 | Jack    | English |    65 |
|   11 | Kevin   | Math    |    83 |
|   12 | Lily    | Science |    53 |
|   13 | Mia     | English |   112 |
|   14 | Noah    | Math    |    74 |
|   15 | Olivia  | Science |    89 |
+------+---------+---------+-------+
15 rows in set (0.04 sec)

mysql> UPDATE STUDENTSCORES SET MARKS=MARKS+3 WHERE MARKS>=80;
Query OK, 9 rows affected (0.04 sec)
Rows matched: 9  Changed: 9  Warnings: 0

mysql> SELECT*FROM STUDENTSCORES;
+------+---------+---------+-------+
| id   | name    | subject | marks |
+------+---------+---------+-------+
|    1 | Alice   | Math    |   110 |
|    2 | Bob     | Math    |    89 |
|    3 | Charlie | Math    |    69 |
|    4 | Diana   | Math    |   103 |
|    5 | Eve     | Math    |    45 |
|    6 | Frank   | Math    |   110 |
|    7 | Grace   | Science |    77 |
|    8 | Henry   | Science |    97 |
|    9 | Ivy     | English |   106 |
|   10 | Jack    | English |    65 |
|   11 | Kevin   | Math    |    86 |
|   12 | Lily    | Science |    53 |
|   13 | Mia     | English |   115 |
|   14 | Noah    | Math    |    74 |
|   15 | Olivia  | Science |    92 |
+------+---------+---------+-------+
15 rows in set (0.00 sec)

mysql> UPDATE STUDENTSCORES SET MARKS=MARKS-1 WHERE MARKS!=95;
Query OK, 15 rows affected (0.00 sec)
Rows matched: 15  Changed: 15  Warnings: 0

mysql> SELECT*FROM STUDENTSCORES;
+------+---------+---------+-------+
| id   | name    | subject | marks |
+------+---------+---------+-------+
|    1 | Alice   | Math    |   109 |
|    2 | Bob     | Math    |    88 |
|    3 | Charlie | Math    |    68 |
|    4 | Diana   | Math    |   102 |
|    5 | Eve     | Math    |    44 |
|    6 | Frank   | Math    |   109 |
|    7 | Grace   | Science |    76 |
|    8 | Henry   | Science |    96 |
|    9 | Ivy     | English |   105 |
|   10 | Jack    | English |    64 |
|   11 | Kevin   | Math    |    85 |
|   12 | Lily    | Science |    52 |
|   13 | Mia     | English |   114 |
|   14 | Noah    | Math    |    73 |
|   15 | Olivia  | Science |    91 |
+------+---------+---------+-------+
15 rows in set (0.00 sec)

mysql> UPDATE STUDENTSCORES SET MARKS=100 WHERE MARKS=95;
Query OK, 0 rows affected (0.00 sec)
Rows matched: 0  Changed: 0  Warnings: 0

mysql> SELECT*FROM STUDENTSCORES;
+------+---------+---------+-------+
| id   | name    | subject | marks |
+------+---------+---------+-------+
|    1 | Alice   | Math    |   109 |
|    2 | Bob     | Math    |    88 |
|    3 | Charlie | Math    |    68 |
|    4 | Diana   | Math    |   102 |
|    5 | Eve     | Math    |    44 |
|    6 | Frank   | Math    |   109 |
|    7 | Grace   | Science |    76 |
|    8 | Henry   | Science |    96 |
|    9 | Ivy     | English |   105 |
|   10 | Jack    | English |    64 |
|   11 | Kevin   | Math    |    85 |
|   12 | Lily    | Science |    52 |
|   13 | Mia     | English |   114 |
|   14 | Noah    | Math    |    73 |
|   15 | Olivia  | Science |    91 |
+------+---------+---------+-------+
15 rows in set (0.00 sec)

mysql> DELETE FROM STUDENTSCORES WHERE MARKS<50;
Query OK, 1 row affected (0.05 sec)

mysql> SELECT*FROM STUDENTSCORES;
+------+---------+---------+-------+
| id   | name    | subject | marks |
+------+---------+---------+-------+
|    1 | Alice   | Math    |   109 |
|    2 | Bob     | Math    |    88 |
|    3 | Charlie | Math    |    68 |
|    4 | Diana   | Math    |   102 |
|    6 | Frank   | Math    |   109 |
|    7 | Grace   | Science |    76 |
|    8 | Henry   | Science |    96 |
|    9 | Ivy     | English |   105 |
|   10 | Jack    | English |    64 |
|   11 | Kevin   | Math    |    85 |
|   12 | Lily    | Science |    52 |
|   13 | Mia     | English |   114 |
|   14 | Noah    | Math    |    73 |
|   15 | Olivia  | Science |    91 |
+------+---------+---------+-------+
14 rows in set (0.00 sec)

mysql> DELETE FROM STUDENTSCORES WHERE MARKS<=60;
Query OK, 1 row affected (0.00 sec)

mysql> SELECT*FROM STUDENTSCORES;
+------+---------+---------+-------+
| id   | name    | subject | marks |
+------+---------+---------+-------+
|    1 | Alice   | Math    |   109 |
|    2 | Bob     | Math    |    88 |
|    3 | Charlie | Math    |    68 |
|    4 | Diana   | Math    |   102 |
|    6 | Frank   | Math    |   109 |
|    7 | Grace   | Science |    76 |
|    8 | Henry   | Science |    96 |
|    9 | Ivy     | English |   105 |
|   10 | Jack    | English |    64 |
|   11 | Kevin   | Math    |    85 |
|   13 | Mia     | English |   114 |
|   14 | Noah    | Math    |    73 |
|   15 | Olivia  | Science |    91 |
+------+---------+---------+-------+
13 rows in set (0.00 sec)

mysql> DELETE FROM STUDENTSCORES WHERE MARKS>90;
Query OK, 7 rows affected (0.04 sec)

mysql> SELECT*FROM STUDENTSCORES;
+------+---------+---------+-------+
| id   | name    | subject | marks |
+------+---------+---------+-------+
|    2 | Bob     | Math    |    88 |
|    3 | Charlie | Math    |    68 |
|    7 | Grace   | Science |    76 |
|   10 | Jack    | English |    64 |
|   11 | Kevin   | Math    |    85 |
|   14 | Noah    | Math    |    73 |
+------+---------+---------+-------+
6 rows in set (0.00 sec)

mysql> DELETE FROM STUDENTSCORES WHERE MARKS>=80;
Query OK, 2 rows affected (0.01 sec)

mysql> SELECT*FROM STUDENTSCORES;
+------+---------+---------+-------+
| id   | name    | subject | marks |
+------+---------+---------+-------+
|    3 | Charlie | Math    |    68 |
|    7 | Grace   | Science |    76 |
|   10 | Jack    | English |    64 |
|   14 | Noah    | Math    |    73 |
+------+---------+---------+-------+
4 rows in set (0.00 sec)

mysql> DELETE FROM STUDENTSCORES WHERE MARKS<>95;
Query OK, 4 rows affected (0.04 sec)

mysql> SELECT*FROM STUDENTSCORES;
Empty set (0.00 sec)

mysql> DELETE FROM STUDENTSCORES WHERE MARKS=76;
Query OK, 0 rows affected (0.00 sec)

mysql> SELECT*FROM STUDENTSCORES;
Empty set (0.00 sec)

mysql>
mysql> CREATE TABLE Employees (
    ->  id INT,
    ->  name VARCHAR(100),
    ->  department VARCHAR(100),
    ->  salary INT,
    ->  isactive BOOLEAN
    ->  );
Query OK, 0 rows affected (0.04 sec)

mysql>
mysql>  -- STEP 2: Insert Records
mysql> INSERT INTO Employees VALUES
    ->  (1, 'Rahul Sharma', 'IT', 50000, TRUE),
    ->  (2, 'Priya Reddy', 'HR', 30000, TRUE),
    ->  (3, 'Amit Kumar', 'Finance', 45000, FALSE),
    ->  (4, 'Sneha Patel', 'IT', 35000, TRUE),
    ->  (5, 'Vikram Singh', 'Finance', 28000, TRUE),
    ->  (6, 'Anjali Mehta', 'HR', 32000, FALSE),
    ->  (7, 'Kiran Rao', 'IT', 60000, TRUE),
    ->  (8, 'Pooja Verma', 'Marketing', 27000, TRUE),
    ->  (9, 'Ramesh Naidu', 'Sales', 38000, TRUE),
    ->  (10, 'Deepika Joshi', 'Finance', 52000, TRUE),
    ->  (11, 'Suresh Babu', 'Marketing', 29000, FALSE),
    ->  (12, 'Neha Kapoor', 'HR', 41000, TRUE),
    ->  (13, 'Arjun Reddy', 'IT', 55000, FALSE),
    ->  (14, 'Lakshmi Devi', 'Sales', 33000, TRUE),
    ->  (15, 'Nikhil Jain', 'IT', 47000, TRUE);
Query OK, 15 rows affected (0.01 sec)
Records: 15  Duplicates: 0  Warnings: 0

mysql>
mysql> SELECT*FROM EMPLOYEES;
+------+---------------+------------+--------+----------+
| id   | name          | department | salary | isactive |
+------+---------------+------------+--------+----------+
|    1 | Rahul Sharma  | IT         |  50000 |        1 |
|    2 | Priya Reddy   | HR         |  30000 |        1 |
|    3 | Amit Kumar    | Finance    |  45000 |        0 |
|    4 | Sneha Patel   | IT         |  35000 |        1 |
|    5 | Vikram Singh  | Finance    |  28000 |        1 |
|    6 | Anjali Mehta  | HR         |  32000 |        0 |
|    7 | Kiran Rao     | IT         |  60000 |        1 |
|    8 | Pooja Verma   | Marketing  |  27000 |        1 |
|    9 | Ramesh Naidu  | Sales      |  38000 |        1 |
|   10 | Deepika Joshi | Finance    |  52000 |        1 |
|   11 | Suresh Babu   | Marketing  |  29000 |        0 |
|   12 | Neha Kapoor   | HR         |  41000 |        1 |
|   13 | Arjun Reddy   | IT         |  55000 |        0 |
|   14 | Lakshmi Devi  | Sales      |  33000 |        1 |
|   15 | Nikhil Jain   | IT         |  47000 |        1 |
+------+---------------+------------+--------+----------+
15 rows in set (0.00 sec)

mysql> SHOW TABLES;
+---------------+
| Tables_in_da6 |
+---------------+
| employees     |
| products      |
| students      |
| studentscores |
+---------------+
4 rows in set (0.00 sec)

mysql> DROP TABLE EMPLOYEES;
Query OK, 0 rows affected (0.01 sec)

mysql>
mysql> CREATE TABLE Employees (
    ->  id INT,
    ->  name VARCHAR(100),
    ->  department VARCHAR(100),
    ->  salary INT,
    ->  isactive BOOLEAN
    ->  );
Query OK, 0 rows affected (0.02 sec)

mysql>
mysql>  -- STEP 2: Insert Records
mysql> INSERT INTO Employees VALUES
    ->  (1, 'Rahul Sharma', 'IT', 50000, TRUE),
    ->  (2, 'Priya Reddy', 'HR', 30000, TRUE),
    ->  (3, 'Amit Kumar', 'Finance', 45000, FALSE),
    ->  (4, 'Sneha Patel', 'IT', 35000, TRUE),
    ->  (5, 'Vikram Singh', 'Finance', 28000, TRUE),
    ->  (6, 'Anjali Mehta', 'HR', 32000, FALSE),
    ->  (7, 'Kiran Rao', 'IT', 60000, TRUE),
    ->  (8, 'Pooja Verma', 'Marketing', 27000, TRUE),
    ->  (9, 'Ramesh Naidu', 'Sales', 38000, TRUE),
    ->  (10, 'Deepika Joshi', 'Finance', 52000, TRUE),
    ->  (11, 'Suresh Babu', 'Marketing', 29000, FALSE),
    ->  (12, 'Neha Kapoor', 'HR', 41000, TRUE),
    ->  (13, 'Arjun Reddy', 'IT', 55000, FALSE),
    ->  (14, 'Lakshmi Devi', 'Sales', 33000, TRUE),
    ->  (15, 'Nikhil Jain', 'IT', 47000, TRUE);
Query OK, 15 rows affected (0.00 sec)
Records: 15  Duplicates: 0  Warnings: 0

mysql>
mysql> SELECT*FROM EMPLOYEES;
+------+---------------+------------+--------+----------+
| id   | name          | department | salary | isactive |
+------+---------------+------------+--------+----------+
|    1 | Rahul Sharma  | IT         |  50000 |        1 |
|    2 | Priya Reddy   | HR         |  30000 |        1 |
|    3 | Amit Kumar    | Finance    |  45000 |        0 |
|    4 | Sneha Patel   | IT         |  35000 |        1 |
|    5 | Vikram Singh  | Finance    |  28000 |        1 |
|    6 | Anjali Mehta  | HR         |  32000 |        0 |
|    7 | Kiran Rao     | IT         |  60000 |        1 |
|    8 | Pooja Verma   | Marketing  |  27000 |        1 |
|    9 | Ramesh Naidu  | Sales      |  38000 |        1 |
|   10 | Deepika Joshi | Finance    |  52000 |        1 |
|   11 | Suresh Babu   | Marketing  |  29000 |        0 |
|   12 | Neha Kapoor   | HR         |  41000 |        1 |
|   13 | Arjun Reddy   | IT         |  55000 |        0 |
|   14 | Lakshmi Devi  | Sales      |  33000 |        1 |
|   15 | Nikhil Jain   | IT         |  47000 |        1 |
+------+---------------+------------+--------+----------+
15 rows in set (0.00 sec)

mysql> SELECT*FROM EMPLOYEES WHERE DEPARTMENT='IT';
+------+--------------+------------+--------+----------+
| id   | name         | department | salary | isactive |
+------+--------------+------------+--------+----------+
|    1 | Rahul Sharma | IT         |  50000 |        1 |
|    4 | Sneha Patel  | IT         |  35000 |        1 |
|    7 | Kiran Rao    | IT         |  60000 |        1 |
|   13 | Arjun Reddy  | IT         |  55000 |        0 |
|   15 | Nikhil Jain  | IT         |  47000 |        1 |
+------+--------------+------------+--------+----------+
5 rows in set (0.00 sec)

mysql> SELECT*FROM EMPLOYEES WHERE DEPARTMENT='IT' AND SALARY>40000;
+------+--------------+------------+--------+----------+
| id   | name         | department | salary | isactive |
+------+--------------+------------+--------+----------+
|    1 | Rahul Sharma | IT         |  50000 |        1 |
|    7 | Kiran Rao    | IT         |  60000 |        1 |
|   13 | Arjun Reddy  | IT         |  55000 |        0 |
|   15 | Nikhil Jain  | IT         |  47000 |        1 |
+------+--------------+------------+--------+----------+
4 rows in set (0.00 sec)

mysql> SELECT*FROM EMPLOYEES WHERE DEPARTMENT='HR' OR SALARY<35000;
+------+--------------+------------+--------+----------+
| id   | name         | department | salary | isactive |
+------+--------------+------------+--------+----------+
|    2 | Priya Reddy  | HR         |  30000 |        1 |
|    5 | Vikram Singh | Finance    |  28000 |        1 |
|    6 | Anjali Mehta | HR         |  32000 |        0 |
|    8 | Pooja Verma  | Marketing  |  27000 |        1 |
|   11 | Suresh Babu  | Marketing  |  29000 |        0 |
|   12 | Neha Kapoor  | HR         |  41000 |        1 |
|   14 | Lakshmi Devi | Sales      |  33000 |        1 |
+------+--------------+------------+--------+----------+
7 rows in set (0.00 sec)

mysql> SELECT*FROM EMPLOYEES WHERE DEPARTMENT<>'HR';
+------+---------------+------------+--------+----------+
| id   | name          | department | salary | isactive |
+------+---------------+------------+--------+----------+
|    1 | Rahul Sharma  | IT         |  50000 |        1 |
|    3 | Amit Kumar    | Finance    |  45000 |        0 |
|    4 | Sneha Patel   | IT         |  35000 |        1 |
|    5 | Vikram Singh  | Finance    |  28000 |        1 |
|    7 | Kiran Rao     | IT         |  60000 |        1 |
|    8 | Pooja Verma   | Marketing  |  27000 |        1 |
|    9 | Ramesh Naidu  | Sales      |  38000 |        1 |
|   10 | Deepika Joshi | Finance    |  52000 |        1 |
|   11 | Suresh Babu   | Marketing  |  29000 |        0 |
|   13 | Arjun Reddy   | IT         |  55000 |        0 |
|   14 | Lakshmi Devi  | Sales      |  33000 |        1 |
|   15 | Nikhil Jain   | IT         |  47000 |        1 |
+------+---------------+------------+--------+----------+
12 rows in set (0.00 sec)

mysql> SELECT*FROM EMPLOYEES WHERE DEPARTMENT='FINANCE' OR(SALARY<30000 AND ISACTIVE=TRUE);
+------+---------------+------------+--------+----------+
| id   | name          | department | salary | isactive |
+------+---------------+------------+--------+----------+
|    3 | Amit Kumar    | Finance    |  45000 |        0 |
|    5 | Vikram Singh  | Finance    |  28000 |        1 |
|    8 | Pooja Verma   | Marketing  |  27000 |        1 |
|   10 | Deepika Joshi | Finance    |  52000 |        1 |
+------+---------------+------------+--------+----------+
4 rows in set (0.00 sec)

mysql>